{
  "kicker": "격자",
  "title": "격자 제목",
  "columns": [
    { "label": "항목" },
    { "label": "기존" },
    { "label": "도입 후" }
  ],
  "rows": [
    {
      "label": "취합 방식",
      "cells": [
        { "v": "이메일 회람" },
        { "v": "게시판 집계", "em": true }
      ]
    },
    {
      "label": "버전 관리",
      "cells": [
        { "v": "수동" },
        { "v": "자동", "chip": true, "em": true }
      ]
    }
  ]
}
