{
  "kicker": "고장 모드 영향 분석 상한",
  "title": "FMEA 핵심 열 발췌 전수 대조표",
  "columns": [
    { "label": "고장 모드" },
    { "label": "고장 영향도" },
    { "label": "원인 분류" },
    { "label": "검출 방법론" },
    { "label": "심각도 등급" },
    { "label": "발생도 등급" },
    { "label": "검출도 등급" },
    { "label": "위험 우선순위" }
  ],
  "rows": [
    {
      "label": "게시 링크 끊김 (Mount 유실 상황)",
      "cells": [
        { "v": "열람 불가 화면 노출" },
        { "v": "참조 삭제" },
        { "v": "링크 무결성 배치" },
        { "v": "S4", "chip": true, "em": true },
        { "v": "O2", "chip": true },
        { "v": "D2", "chip": true },
        { "v": "16" }
      ]
    },
    {
      "label": "동시 편집 충돌 (잠금 미획득)",
      "cells": [
        { "v": "마지막 저장만 생존" },
        { "v": "잠금 우회" },
        { "v": "저장 이력 대조" },
        { "v": "S5", "chip": true, "em": true },
        { "v": "O3", "chip": true },
        { "v": "D3", "chip": true },
        { "v": "45" }
      ]
    },
    {
      "label": "권한 상승 누락 (보직장 교체)",
      "cells": [
        { "v": "결재선 단절" },
        { "v": "인사 연동 지연" },
        { "v": "권한 감사 로그" },
        { "v": "S4", "chip": true, "em": true },
        { "v": "O2", "chip": true },
        { "v": "D4", "chip": true },
        { "v": "32" }
      ]
    },
    {
      "label": "첨부 대용량 업로드 실패",
      "cells": [
        { "v": "본문만 저장됨" },
        { "v": "용량 상한 미고지" },
        { "v": "업로드 재시도 큐" },
        { "v": "S2", "chip": true },
        { "v": "O4", "chip": true },
        { "v": "D1", "chip": true },
        { "v": "8" }
      ]
    },
    {
      "label": "알림 인박스 지연 (배치 적체)",
      "cells": [
        { "v": "코멘트 미인지" },
        { "v": "큐 소비 정체" },
        { "v": "지연 임계 경보" },
        { "v": "S3", "chip": true },
        { "v": "O3", "chip": true },
        { "v": "D2", "chip": true },
        { "v": "18" }
      ]
    },
    {
      "label": "종합보고 참조 순환 (자기 포함)",
      "cells": [
        { "v": "조립 무한 대기" },
        { "v": "순환 검증 부재" },
        { "v": "그래프 사이클 검사" },
        { "v": "S4", "chip": true, "em": true },
        { "v": "O1", "chip": true },
        { "v": "D3", "chip": true },
        { "v": "12" }
      ]
    },
    {
      "label": "템플릿 버전 불일치 (구버전 로드)",
      "cells": [
        { "v": "블록 렌더 깨짐" },
        { "v": "마이그레이션 누락" },
        { "v": "버전 스키마 검증" },
        { "v": "S3", "chip": true },
        { "v": "O2", "chip": true },
        { "v": "D2", "chip": true },
        { "v": "12" }
      ]
    },
    {
      "label": "백업 복원 리허설 미실시",
      "cells": [
        { "v": "복구 시간 미보장" },
        { "v": "운영 절차 공백" },
        { "v": "분기 복원 훈련" },
        { "v": "S5", "chip": true, "em": true },
        { "v": "O2", "chip": true },
        { "v": "D5", "chip": true },
        { "v": "50" }
      ]
    }
  ],
  "omitted": 4,
  "note": {
    "pre": "위험 우선순위 상위 ",
    "strong": "2건(45·50)",
    "post": " 이 즉시 조치 대상"
  },
  "frame": {
    "brand": "ReportArchive 운영협의회",
    "idx": "05",
    "total": "07"
  }
}
